US7170811035,PFE,Pfizer Inc,ORD,PFE,Pfizer Inc,ORD,Ordinary Share,US7170811035,131.6936064,NULL,8.44717712,A1,"Pfizer Inc. (Pfizer) is a research-based global biopharmaceutical company. The Company is engaged in discovering, developing and manufacturing of healthcare products. The Company's segments include Pfizer Innovative Health (IH) and Pfizer Essential Health (EH). Its biopharmaceutical products include Lipitor, Sutent and the Premarin family of products. Its biotechnology products include BeneFIX, ReFacto and Xyntha. The Company's contract manufacturing business, Pfizer CentreOne, consists of its contract manufacturing and active pharmaceutical ingredient sales operation, including manufacturing and supply agreements with Zoetis Inc., and Hospira¡¯s One-2-One sterile injectables contract manufacturing operation. Its research focuses on six areas, which include immunology and inflammation, cardiovascular and metabolic diseases, oncology, vaccines, neuroscience and pain, and rare diseases. The Company's subsidiaries include Hospira, Inc. and Medivation, Inc.",35,Health Care,"Pharmaceuticals, Biotechnology & Life Sciences",Pharmaceuticals,Pharmaceuticals,1.98E+11,Pfizer IncUS7427181091,PG,Procter & Gamble Co,ORD,PG,Procter & Gamble Co,ORD,Ordinary Share,US7427181091,111.1748462,NULL,5.368154028,WR,"The Procter & Gamble Company is focused on providing branded consumer packaged goods to the consumers across the world. The Company operates through five segments: Beauty; Grooming; Health Care; Fabric & Home Care, and Baby, Feminine & Family Care. The Company sells its products in approximately 180 countries and territories primarily through mass merchandisers, grocery stores, membership club stores, drug stores, department stores, distributors, baby stores, specialty beauty stores, e-commerce, high-frequency stores and pharmacies. The Company owns and operates approximately 20 manufacturing sites located in over 20 states in the United States. In addition, it owns and operates over 100 manufacturing sites in approximately 40 countries. It offers products under the brands, such as Olay, Old Spice, Safeguard, Head & Shoulders, Pantene, Rejoice, Mach3, Prestobarba, Venus, Cascade, Dawn, Febreze, Mr. Clean, Bounty and Charmin.",30,Consumer Staples,Household & Personal Products,Household Products,Household Products,2.24E+11,Procter & Gamble CoUS89417E1091,TRV,Travelers Companies Inc,ORD,TRV,Travelers Companies Inc,ORD,Ordinary Share,US89417E1091,105.4870188,NULL,10.69903854,BBB+,"The Travelers Companies, Inc. is a holding company. The Company, through its subsidiaries, is engaged in providing a range of commercial and personal property and casualty insurance products and services to businesses, government units, associations and individuals. It operates through three segments: Business and International Insurance; Bond & Specialty Insurance, and Personal Insurance. Business and International Insurance offers an array of property and casualty insurance and insurance related services to its clients, in the United States and in Canada, as well as in the United Kingdom, Brazil and throughout other parts of the world. Bond & Specialty Insurance provides surety, fidelity, management liability, professional liability, and other property and casualty coverages and related risk management services to a range of domestic customers. Personal Insurance writes a range of property and casualty insurance covering individuals' personal risks.",40,Financials,Insurance,Insurance,Property & Casualty Insurance,31326000494,Travelers Companies IncUS91324P1021,UNH,UnitedHealth Group Inc,ORD,UNH,UnitedHealth Group Inc,ORD,Ordinary Share,US91324P1021,129.7637627,NULL,31.13285122,F1,"UnitedHealth Group Incorporated is a diversified healthcare company. The Company operates through four segments: UnitedHealthcare, OptumHealth, OptumInsight and OptumRx. The Company conducts its operations through two business platforms: health benefits operating under UnitedHealthcare and health services operating under Optum. UnitedHealthcare provides healthcare benefits to a range of customers and markets through its UnitedHealthcare Employer & Individual, UnitedHealthcare Medicare & Retirement, UnitedHealthcare Community & State, and UnitedHealthcare Global businesses. Optum is a health services business serving the healthcare marketplace, including payers, care providers, employers, governments, life sciences companies and consumers, through its OptumHealth, OptumInsight and OptumRx businesses.",35,Health Care,Health Care Equipment & Services,Health Care Providers & Services,Managed Health Care,1.39E+11,UnitedHealth Group IncUS9130171096,UTX,United Technologies Corp,ORD,UTX,United Technologies Corp,ORD,Ordinary Share,US9130171096,105.1313583,NULL,7.034674094,F2,"United Technologies Corporation is engaged in providing high technology products and services to the building systems and aerospace industries around the world. The Company operates through four segments: Otis; UTC Climate, Controls & Security; Pratt & Whitney, and UTC Aerospace Systems. Its Otis segment designs, manufactures, sells and installs a range of passenger and freight elevators, as well as a line of escalators and moving walkways. Its UTC Climate, Controls & Security segment, is the provider of heating, ventilating, air conditioning (HVAC) and refrigeration solutions. The Company's Pratt & Whitney segment supplies aircraft engines for the commercial, military, business jet and general aviation markets. Its UTC Aerospace Systems segment is a provider of aerospace products and aftermarket service solutions.",20,Industrials,Capital Goods,Aerospace & Defense,Aerospace & Defense,89635943087,United Technologies CorpUS92826C8394,V,Visa Inc,ORD,V,Visa Inc,ORD,Ordinary Share,US92826C8394,67.13995062,NULL,28.41868278,A+,"Visa Inc. is a payments technology company. The Company and its subsidiaries, including Visa U.S.A. Inc. (Visa U.S.A.), Visa International Service Association (Visa International), Visa Worldwide Pte. Limited, Visa Canada Corporation, Inovant LLC and CyberSource Corporation (CyberSource), operate a processing network, VisaNet, which facilitates authorization, clearing and settlement of payment transactions around the world. The Company also offers fraud protection for account holders and rapid payment for merchants. The Company provides its services to consumers, businesses, financial institutions and governments in over 200 countries and territories for electronic payments. It provides a range of payment solutions that support payment products that issuers can offer to their account holders, including pay now with debit, pay ahead with prepaid or pay later with credit products. It also offers a suite of digital, e-commerce, person-to-person payments, and mobile products and services.",45,Information Technology,Software & Services,IT Services,Data Processing & Outsourced Services,1.93E+11,Visa IncUS92343V1044,VZ,Verizon Communications Inc,ORD,VZ,Verizon Communications Inc,ORD,Ordinary Share,US92343V1044,94.57437907,NULL,2.976670365,F2,"Verizon Communications Inc. (Verizon) is a holding company. The Company, through its subsidiaries, provides communications, information and entertainment products and services to consumers, businesses and governmental agencies. The Company offers voice, data and video services and solutions on its wireless and wireline networks. The Company's segments include Wireless and Wireline. The Wireless segment offers communications products and services, including wireless voice and data services and equipment sales that are provided to consumer, business and government customers across the United States. The Wireline's segment offers voice, data and video communications products and services, such as broadband video and data, corporate networking solutions, data center and cloud services, security and managed network services and local and long distance voice services. The Company provides these products and services to consumers as well as to carriers, businesses and government customers.",50,Telecommunication Services,Telecommunication Services,Diversified Telecommunication Services,Integrated Telecommunication Services,1.90E+11,Verizon Communications IncUS9311421039,WMT,Wal Mart Stores Inc,ORD,WMT,Wal Mart Stores Inc,ORD,Ordinary Share,US9311421039,126.1954079,NULL,6.496522811,WR,"Wal-Mart Stores, Inc. is engaged in the operation of retail, wholesale and other units in various formats around the world. The Company offers an assortment of merchandise and services at everyday low prices (EDLP). The Company operates through three segments: Walmart U.S., Walmart International and Sam's Club. The Walmart U.S. segment operates retail stores in approximately 50 states in the United States, Washington D.C. and Puerto Rico, with three primary store formats, as well as digital retail. The Walmart U.S. segment is a mass merchandiser of consumer products, operating under the Walmart or Wal-Mart brands, as well as walmart.com. The Walmart International segment consists of operations in over 27 countries outside of the United States. The Sam's Club consists of membership-only warehouse clubs and operates in approximately 48 states in the United States and in Puerto Rico, as well as digital retail.",30,Consumer Staples,Food & Staples Retailing,Food & Staples Retailing,Hypermarkets & Super Centers,2.20E+11,Wal Mart Stores IncUS30231G1022,XOM,Exxon Mobil Corp,ORD,XOM,Exxon Mobil Corp,ORD,Ordinary Share,US30231G1022,92.02636206,NULL,10.00410885,AA+,"Exxon Mobil Corporation is an energy company. The Company is engaged in the exploration and production of crude oil and natural gas, manufacturing of petroleum products, and transportation and sale of crude oil, natural gas and petroleum products. The Company also manufactures and markets petrochemicals, including olefins, aromatics, polyethylene and polypropylene plastics, and various specialty products. The Company operates through the Upstream, Downstream, Chemical, and Corporate and Financing segments. The Upstream segment operates to explore for and produce crude oil and natural gas. The Downstream segment operates to manufacture and sell petroleum products. The Chemical segment operates to manufacture and sell petrochemicals. The Company's projects include the Kearl project, Heidelberg project, the Point Thomson project, the Hadrian South project, the Lucius project, the Barzan project, the Arkutun-Dagi project, and the Upper Zakum 750 project, among others.",10,Energy,Energy,"Oil, Gas & Consumable Fuels",Integrated Oil & Gas,3.55E+11,Exxon Mobil Corp