ISIN_Stock,Exchange Ticker,MyName,MyAssetClass,RIC,Instrument Description,Asset Category Code,Asset Category Description,ISIN,Dividend Yield Relative to Sector,Net Dividend Yield,5 Year Dividend Per Share Growth,Issuer Rating,Business Description,GICS Sector Code,GICS Sector Name,GICS Industry Group Name,GICS Industry Name,GICS Sub-Industry Name,Company Market Cap,Company NameUS0378331005,AAPL,Apple Inc,ORD,AAPL.O,Apple Inc,ORD,Ordinary Share,US0378331005,97.92250575,NULL,NULL,P-1,"Apple Inc. designs, manufactures and markets mobile communication and media devices, personal computers and portable digital music players. The Company sells a range of related software, services, accessories, networking solutions, and third-party digital content and applications. The Company's segments include the Americas, Europe, Greater China, Japan and Rest of Asia Pacific. The Americas segment includes both North and South America. The Europe segment includes European countries, India, the Middle East and Africa. The Greater China segment includes China, Hong Kong and Taiwan. The Rest of Asia Pacific segment includes Australia and the Asian countries not included in the Company's other operating segments. Its products and services include iPhone, iPad, Mac, iPod, Apple Watch, Apple TV, a portfolio of consumer and professional software applications, iPhone OS (iOS), OS X and watchOS operating systems, iCloud, Apple Pay and a range of accessory, service and support offerings.",45,Information Technology,Technology Hardware & Equipment,"Technology Hardware, Storage & Peripherals","Technology Hardware, Storage & Peripherals",5.78E+11,Apple IncUS0258161092,AXP,American Express Co,ORD,AXP,American Express Co,ORD,Ordinary Share,US0258161092,91.36095297,NULL,10.57142153,WR,"American Express Company is a services company. The Company's principal products and services are charge and credit payment card products, and travel-related services offered to consumers and businesses around the world. The Company's segments include U.S. Consumer Services (USCS), International Consumer and Network Services (ICNS), Global Commercial Services (GCS) and Global Merchant Services (GMS). The USCS segment includes the U.S. Consumer Card Services business and travel services in the United States. The ICNS segment includes the International Consumer Card Services business, Global Network Services (GNS) business and travel services outside the United States. The GCS segment includes the Global Corporate Payments (GCP) business, small business services businesses in the United States and internationally, merchant financing products and foreign exchange services operations. The GMS segment includes the Global Merchant Services business and global loyalty coalition businesses.",40,Financials,Diversified Financials,Consumer Finance,Consumer Finance,64525504220,American Express CoUS0970231058,BA,Boeing Co,ORD,BA,Boeing Co,ORD,Ordinary Share,US0970231058,127.4480197,NULL,21.01395128,F1,"The Boeing Company is an aerospace firm. The Company operates in five segments: Commercial airplanes; Defense, Space & Security (BDS) business, such as Boeing Military Aircraft (BMA), Network & Space Systems (N&SS) and Global Services & Support (GS&S), and Boeing Capital (BCC). Its Commercial Airplanes segment develops, produces and markets commercial jet aircraft, which provides related support services to the commercial airline industry. Its BMA segment is engaged in the research, development, production and modification of military aircraft and weapons systems. Its N&SS segment is engaged in the research, development, production and modification of the products and related services, such as electronics, strategic missile and defense systems, and information solutions, among others. Its GS&S segment provides services to aircraft and systems. Its BCC's segment portfolio consists of equipment under operating leases, finance leases, notes and other receivables and assets held for sale.",20,Industrials,Capital Goods,Aerospace & Defense,Aerospace & Defense,91661479765,Boeing CoUS1491231015,CAT,Caterpillar Inc,ORD,CAT,Caterpillar Inc,ORD,Ordinary Share,US1491231015,112.7505901,NULL,11.34113452,P-1,"Caterpillar Inc. is a manufacturer of construction and mining equipment, diesel and natural gas engines, industrial gas turbines and diesel-electric locomotives. The Company operates through its three product segments: Resource Industries, Construction Industries, and Energy & Transportation. It also provides financing and related services through its Financial Products segment. Its Construction Industries segment provides machinery for infrastructure and building construction applications. Its Resource Industries segment offers machinery for mine and quarry applications. Its Energy & Transportation segment offers reciprocating engines, generator sets, gas turbines and turbine-related services, diesel-electric locomotives and other rail-related products and services. Its Financial Products segment conducts its business through Caterpillar Financial Services Corporation (Cat Financial). Cat Financial provides retail and wholesale financing alternatives for Caterpillar products.",20,Industrials,Capital Goods,Machinery,Construction Machinery & Heavy Trucks,54417601131,Caterpillar IncUS17275R1023,CSCO,Cisco Systems Inc,ORD,CSCO.O,Cisco Systems Inc,ORD,Ordinary Share,US17275R1023,108.7059229,NULL,NULL,P-1,"Cisco Systems, Inc. designs and sells a range of products, provides services and delivers integrated solutions to develop and connect networks around the world. The Company operates through three geographic segments: Americas; Europe, the Middle East and Africa (EMEA), and Asia Pacific, Japan and China (APJC). The Company groups its products and technologies into various categories, such as Switching; Next-Generation Network (NGN) Routing; Collaboration; Data Center; Wireless; Service Provider Video; Security, and Other Products. In addition to its product offerings, the Company provides a range of service offerings, including technical support services and advanced services. The Company delivers its technology and services to its customers as solutions for their priorities, including cloud, video, mobility, security, collaboration and analytics. The Company serves customers, including businesses of all sizes, public institutions, governments and service providers.",45,Information Technology,Technology Hardware & Equipment,Communications Equipment,Communications Equipment,1.58E+11,Cisco Systems IncUS1667641005,CVX,Chevron Corp,ORD,CVX,Chevron Corp,ORD,Ordinary Share,US1667641005,107.0200254,NULL,6.782420871,AA (low),"Chevron Corporation (Chevron) manages its investments in subsidiaries and affiliates and provides administrative, financial, management and technology support to the United States and international subsidiaries that engage in integrated energy and chemicals operations. The Company operates through two business segments: Upstream and Downstream. The Upstream segment consists primarily of exploring for, developing and producing crude oil and natural gas; transporting crude oil by international oil export pipelines; transporting, storage and marketing of natural gas, and a gas-to-liquids plant. Downstream operations consist primarily of refining crude oil into petroleum products; marketing of crude oil and refined products; transporting crude oil and refined products by pipeline, marine vessel, motor equipment and rail car, and manufacturing and marketing of commodity petrochemicals, plastics for industrial uses and fuel and lubricant additives.",10,Energy,Energy,"Oil, Gas & Consumable Fuels",Integrated Oil & Gas,2.01E+11,Chevron CorpUS2635341090,DD,E I du Pont de Nemours and Co,ORD,DD,E I du Pont de Nemours and Co,ORD,Ordinary Share,US2635341090,77.58609368,NULL,-1.508228699,F1,"E. I. du Pont de Nemours and Company (DuPont) is a science and technology-based company. The Company consists of over 10 businesses aggregated into six segments: Agriculture, Electronics & Communications, Industrial Biosciences, Nutrition & Health, Performance Materials and Safety & Protection. Its products include corn hybrids and soybean varieties, herbicides, fungicides and insecticides in Agriculture segment; photopolymers and electronic materials in Electronics & Communications segment; enzymes and bio-based materials in Industrial Biosciences segment; cultures, emulsifiers, texturants, natural sweeteners and soy-based food ingredients in Nutrition & Health segment; engineering polymers, packaging and industrial polymers, films and elastomers in Performance Materials segment, and nonwovens, aramids and solid surfaces in Safety & Protection segment. It is also involved in other businesses, such as pre-commercial programs, nonaligned businesses and pharmaceuticals in other.",15,Materials,Materials,Chemicals,Diversified Chemicals,60167159820,E I du Pont de Nemours and CoUS2546871060,DIS,Walt Disney Co,ORD,DIS,Walt Disney Co,ORD,Ordinary Share,US2546871060,93.90881899,NULL,27.91813389,F1,"The Walt Disney Company is a diversified entertainment company. The Company's business segments include Media Networks, Parks and Resorts, Studio Entertainment, Consumer Products and Interactive. The Media Networks segment includes cable and broadcast television networks, television production operations, television distribution, domestic television stations, and radio networks and stations. The Parks and Resorts segment owns and operates the Walt Disney World Resort in Florida, the Disney Cruise Line and Adventures by Disney. The Studio Entertainment segment produces live-action and animated motion pictures, musical recordings and live stage plays. The Consumer Products segment engages with licensees, publishers and retailers to design and sell a range of products based on the Company's property through its licensing, publishing and retail businesses. The Interactive segment creates and delivers branded entertainment and lifestyle content across interactive media platforms.",25,Consumer Discretionary,Media,Media,Movies & Entertainment,1.57E+11,Walt Disney CoUS3696041033,GE,General Electric Co,ORD,GE,General Electric Co,ORD,Ordinary Share,US3696041033,109.2090715,NULL,9.665990814,A1,"General Electric Company (GE) is a global digital industrial company. The Company's products and services range from aircraft engines, power generation and oil and gas production equipment to medical imaging, financing and industrial products. Its segments include Power segment offers products and services related to energy production and water reuse; Renewable Energy segment offers renewable power sources; Oil & Gas offers drilling, completion, production and oil field operation; Energy Management offers technologies to electrical power; Aviation designs and produces commercial and military aircraft engines, integrated digital components and mechanical aircraft systems; Healthcare provides essential healthcare technologies; Transportation is a supplier to the railroad, mining, marine, stationary power and drilling industries; Appliances & Lighting offers appliances and a subset of lighting products, and Capital offers continuing financial services businesses and products.",20,Industrials,Capital Goods,Industrial Conglomerates,Industrial Conglomerates,2.72E+11,General Electric CoUS38141G1040,GS,Goldman Sachs Group Inc,ORD,GS,Goldman Sachs Group Inc,ORD,Ordinary Share,US38141G1040,86.62161661,NULL,13.17983656,F1,"The Goldman Sachs Group, Inc. is a bank holding company and a financial holding company. The Company operates through four segments: Investment Banking, Institutional Client Services, Investing & Lending, and Investment Management. The Company's Investment Banking segment provides financial advisory services, which include advisory assignments with respect to mergers and acquisitions, divestitures, corporate defense activities, restructurings, spin-offs and risk management. The Company's Institutional Client Services segment makes markets and facilitates client transactions in fixed income, equity, currency and commodity products. The Company's investing and lending activities include its investing and relationship lending activities across various asset classes, primarily debt securities and loans, public and private equity securities, and real estate. The Company's investment management segment provides investment and wealth advisory services.",40,Financials,Diversified Financials,Capital Markets,Investment Banking & Brokerage,81096581315,Goldman Sachs Group IncUS4370761029,HD,Home Depot Inc,ORD,HD,Home Depot Inc,ORD,Ordinary Share,US4370761029,99.24822447,NULL,20.08701201,F1,"The Home Depot, Inc. (The Home Depot) is a home improvement retailer. The Company sells an assortment of building materials, home improvement products, and lawn and garden products, and provides various services. The Home Depot stores serve three primary customer groups: do-it-yourself (DIY) customers, do-it-for-me (DIFM) customers and professional customers. Its DIY customers are home owners who purchase products and complete their own projects and installations. The Company assists these customers with specific product and installation questions both in its stores and through online resources and other media designed to provide product and project knowledge. Its DIFM customers are home owners who purchase materials themselves and hire third parties to complete the project or installation. Professional Customers are primarily professional renovators/remodelers, general contractors, repairmen, installers, small business owners and tradesmen.",25,Consumer Discretionary,Retailing,Specialty Retail,Home Improvement Retail,1.60E+11,Home Depot IncUS4592001014,IBM,International Business Machines Corp,ORD,IBM,International Business Machines Corp,ORD,Ordinary Share,US4592001014,114.924723,NULL,13.6561494,P-1,"International Business Machines Corporation (IBM) is a technology company. The Company operates through five segments: Global Technology Services (GTS), Global Business Services (GBS), Software, Systems Hardware and Global Financing. The Company's GTS segment offers services, including strategic outsourcing, integrated technology services, cloud and technology support services (maintenance services). Its GBS segment provides consulting and systems integration, application management services and process services. The software segment consists primarily of middleware and operating systems software. The Systems Hardware segment provides clients with infrastructure technologies. The Company's Global Financing segment includes client financing, commercial financing, and remanufacturing and remarketing.",45,Information Technology,Software & Services,IT Services,IT Consulting & Other Services,1.53E+11,International Business Machines CorpUS4581401001,INTC,Intel Corp,ORD,INTC.O,Intel Corp,ORD,Ordinary Share,US4581401001,121.7740702,NULL,5.857321166,F1,"Intel Corporation is engaged in the design and manufacture of digital technology platforms. The Company's segments include Client Computing Group (CCG), Data Center Group (DCG), Internet of Things Group (IOTG), Software and Services (SSG) and All Other. CCG segment includes platforms designed for notebooks (including Ultrabook devices), 2 in 1 systems, desktops (including all-in-ones and personal computers (PCs)), tablets, phones, wireless and wired connectivity products, and mobile communication components. DCG segment includes server, network and storage platforms designed for the enterprise, cloud, communications infrastructure and technical computing segments. IOTG segment includes platforms designed for Internet of Things market segments, including retail, transportation, industrial, and buildings and home use. SSG segment includes Intel Security Group, and Software and Services group. All Other segment includes Non-Volatile Memory Solutions Group and the New Devices Group.",45,Information Technology,Semiconductors & Semiconductor Equipment,Semiconductors & Semiconductor Equipment,Semiconductors,1.64E+11,Intel CorpUS4781601046,JNJ,Johnson & Johnson,ORD,JNJ,Johnson & Johnson,ORD,Ordinary Share,US4781601046,98.38645652,NULL,6.961037573,Aaa,"Johnson & Johnson is a holding company, which is engaged in the research and development, manufacture and sale of a range of products in the healthcare field. The Company's segments include Consumer, Pharmaceutical and Medical Devices. The Consumer segment includes a range of products used in the baby care, oral care, skin care, over-the-counter pharmaceutical, women's health and wound care markets. The Pharmaceutical segment is focused on over five therapeutic areas, including immunology, infectious diseases, neuroscience, oncology, and cardiovascular and metabolic diseases. The Medical Devices segment includes a range of products used in the orthopedic, surgery, cardiovascular, diabetes care and vision care fields. Its research facilities are located in the United States, Belgium, Brazil, Canada, China, France, Germany, India, Israel, Japan, the Netherlands, Singapore, Switzerland and the United Kingdom.",35,Health Care,"Pharmaceuticals, Biotechnology & Life Sciences",Pharmaceuticals,Pharmaceuticals,3.22E+11,Johnson & JohnsonUS46625H1005,JPM,JPMorgan Chase & Co,ORD,JPM,JPMorgan Chase & Co,ORD,Ordinary Share,US46625H1005,108.8482607,NULL,18.1260188,F1,"JPMorgan Chase & Co. is a financial holding company. The Company is engaged in investment banking, financial services. It operates in four segments, as well as a Corporate segment. Its segments are Consumer & Community Banking, Corporate & Investment Bank, Commercial Banking and Asset Management. The Consumer & Community Banking segment serves consumers and businesses through personal service at bank branches and through automatic teller machines, online, mobile and telephone banking. The Corporate & Investment Bank segment, comprising Banking and Markets & Investor Services, offers investment banking, market-making, prime brokerage, and treasury and securities products and services to corporations, investors, financial institutions, and government and municipal entities. The Commercial Banking segment provides financial solutions, including lending, treasury services, investment banking and asset management. The Asset Management segment comprises investment and wealth management.",40,Financials,Banks,Banks,Diversified Banks,2.74E+11,JPMorgan Chase & CoUS1912161007,KO,Coca-Cola Co,ORD,KO,Coca-Cola Co,ORD,Ordinary Share,US1912161007,112.542899,NULL,8.329682611,F1,"The Coca-Cola Company is a beverage company. The Company owns or licenses and markets over 500 nonalcoholic beverage brands, primarily sparkling beverages but also a range of still beverages, such as waters, enhanced waters, juices and juice drinks, ready-to-drink teas and coffees, and energy and sports drinks. The Company's segments include Eurasia and Africa, Europe, Latin America, North America, Asia Pacific, Bottling Investments and Corporate. It owns and markets a range of nonalcoholic sparkling beverage brands, including Coca-Cola, Diet Coke, Fanta and Sprite. It markets, manufactures and sells beverage concentrates, which are referred to as beverage bases, and syrups, including fountain syrups (concentrate business or concentrate operations), and finished sparkling and still beverages (finished product business or finished product operations). In the United States, it manufactures fountain syrups and sells them to fountain retailers, such as restaurants and convenience stores.",30,Consumer Staples,"Food, Beverage & Tobacco",Beverages,Soft Drinks,1.77E+11,Coca-Cola CoUS5801351017,MCD,McDonald's Corp,ORD,MCD,McDonald's Corp,ORD,Ordinary Share,US5801351017,120.6994465,NULL,7.368611335,BBB,"McDonald's Corporation (McDonald's) operates and franchises McDonald's restaurants. The Company's restaurants serve a locally-relevant menu of quality food and drinks sold at various price points in over 100 countries. The Company's segments include U.S., International Lead Markets, High Growth Markets and Foundational Markets and Corporate. Of the approximately 36,525 restaurants in over 120 countries, approximately 30,080 are franchised and over 6,444 are operated by the Company. McDonald's franchised restaurants are owned and operated under various structures, including conventional franchise, developmental license or affiliate. The Company is primarily a franchisor, with over 80% of McDonald's restaurants owned and operated by independent franchisees. Under a conventional franchise arrangement, the Company owns the land and building or secures a long-term lease for the restaurant location and the franchisee pays for equipment, signs, seating and decor.",25,Consumer Discretionary,Consumer Services,"Hotels, Restaurants & Leisure",Restaurants,94853271076,McDonald's CorpUS88579Y1010,MMM,3M Co,ORD,MMM,3M Co,ORD,Ordinary Share,US88579Y1010,91.96503198,NULL,15.07793439,P-1,"3M Company is a technology company. The Company operates through five segments. Its Industrial segment serves markets, such as automotive original equipment manufacturer and automotive aftermarket, electronics, appliance, paper and printing, packaging, food and beverage, and construction. Its Safety and Graphics segment serves markets for the safety, security and productivity of people, facilities and systems. Its Health Care segment serves markets that include medical clinics and hospitals, pharmaceuticals, dental and orthodontic practitioners, health information systems, and food manufacturing and testing. Its Electronics and Energy segment serves customers in electronics and energy markets, including solutions for electronic devices; electrical products; telecommunications networks, and power generation and distribution. Its Consumer segment serves markets that include consumer retail, office business to business, home improvement, drug and pharmacy retail, and other markets.",20,Industrials,Capital Goods,Industrial Conglomerates,Industrial Conglomerates,1.05E+11,3M CoUS58933Y1055,MRK,Merck & Co Inc,ORD,MRK,Merck & Co Inc,ORD,Ordinary Share,US58933Y1055,104.1047149,NULL,3.895047749,P-1,"Merck & Co., Inc. is a global healthcare company. The Company offers health solutions through its prescription medicines, vaccines, biologic therapies and animal health products, which it markets directly and through its joint ventures. It operates through one segment, Pharmaceutical. The Company's Pharmaceutical segment includes human health pharmaceutical and vaccine products marketed either directly by the Company or through joint ventures. Human health pharmaceutical products consist of therapeutic and preventive agents, generally sold by prescription, for the treatment of human disorders. The Company sells these human health pharmaceutical products primarily to drug wholesalers and retailers, hospitals, government agencies and managed healthcare providers. The Animal Health segment discovers, develops, manufactures and markets animal health products, including vaccines. The Company's animal health products are sold to veterinarians, distributors and animal producers.",35,Health Care,"Pharmaceuticals, Biotechnology & Life Sciences",Pharmaceuticals,Pharmaceuticals,1.76E+11,Merck & Co IncUS5949181045,MSFT,Microsoft Corp,ORD,MSFT.O,Microsoft Corp,ORD,Ordinary Share,US5949181045,112.637043,NULL,16.67066799,P-1,"Microsoft Corporation is a technology company. The Company develops, licenses and supports a range of software products, services and devices. Its segments are Productivity and Business Processes, Intelligent Cloud, and More Personal Computing. Its products include operating systems; cross-device productivity applications; server applications; business solution applications; desktop and server management tools; software development tools; video games, and training and certification of computer system integrators and developers. It also designs, manufactures, and sells devices, including personal computers, tablets, gaming and entertainment consoles, phones, other intelligent devices, and related accessories, that integrate with its cloud-based offerings. It offers an array of services, including cloud-based solutions that provide customers with software, services, platforms, and content, and it provides solution support and consulting services. It also delivers online advertising.",45,Information Technology,Software & Services,Software,Systems Software,4.59E+11,Microsoft CorpUS6541061031,NKE,Nike Inc,ORD,NKE,Nike Inc,ORD,Ordinary Share,US6541061031,101.4483907,NULL,15.67885797,P-1,"NIKE, Inc. is engaged in the design, development, marketing and selling of athletic footwear, apparel, equipment, accessories and services. The Company's operating segments include North America, Western Europe, Central & Eastern Europe, Greater China, Japan and Emerging Markets. Its portfolio brands include the NIKE Brand, Jordan Brand, Hurley and Converse. As of May 31, 2016, the Company focused its NIKE brand product offerings in nine categories: Running, NIKE Basketball, the Jordan Brand, Football (Soccer), Men's Training, Women's Training, Action Sports, Sportswear (its sports-inspired lifestyle products) and Golf. Men's Training includes its baseball and American football product offerings. It also markets products designed for kids, as well as for other athletic and recreational uses, such as cricket, lacrosse, tennis, volleyball, wrestling, walking and outdoor activities. The Company sells a range of performance equipment and accessories under the NIKE Brand name.",25,Consumer Discretionary,Consumer Durables & Apparel,"Textiles, Apparel & Luxury Goods",Footwear,84554094639,Nike Inc